Sr.No.,Name,Grade,Certification Type,Issuing Organization,Actual Date,Issue Month,Credential ID,Credential URL
1,Deep Neural Networks with PyTorch (with Honors),100,Course,DeepLearning.AI,2022-06-10,22-Jun,SRV74UW2U9FK,https://www.coursera.org/account/accomplishments/certificate/SRV74UW2U9FK
2,Build Better Generative Adversarial Networks (GANs),100,Course,DeepLearning.AI,2022-07-28,22-Jul,QDW54F7CHUSN,https://www.coursera.org/account/accomplishments/certificate/QDW54F7CHUSN
3,Apply Generative Adversarial Networks (GANs),100,Course,DeepLearning.AI,2022-07-31,22-Jul,8S5WDVFKMVMC,https://www.coursera.org/account/accomplishments/certificate/8S5WDVFKMVMC
4,Build Basic Generative Adversarial Networks (GANs),100,Course,DeepLearning.AI,2022-07-22,22-Jul,95CJWGJ5A6GR,https://www.coursera.org/account/accomplishments/certificate/95CJWGJ5A6GR
5,Scripting with Python and SQL for Data Engineering,98,Course,Duke University,2022-05-19,22-May,J6E57H5QZV75,https://www.coursera.org/account/accomplishments/certificate/J6E57H5QZV75
6,Python and Pandas for Data Engineering,96.87,Course,Duke University,2022-05-20,22-May,HZBKMCLYSWMK,https://www.coursera.org/account/accomplishments/certificate/HZBKMCLYSWMK
7,Linux and Bash for Data Engineering,100,Course,Duke University,2022-05-29,22-May,WTXCY844YEJR,https://www.coursera.org/account/accomplishments/certificate/WTXCY844YEJR
8,Web Applications and Command-Line Tools for Data Engineering,100,Course,Duke University,2022-05-26,22-May,QLH97VWNKCMU,https://www.coursera.org/account/accomplishments/certificate/QLH97VWNKCMU
9,Share Data Through the Art of Visualization,88.02,Course,Google,2022-08-21,22-Aug,EX6ZJECC8DCU,https://www.coursera.org/account/accomplishments/certificate/EX6ZJECC8DCU
10,Google Data Analytics Capstone: Complete a Case Study,100,Course,Google,2022-08-24,22-Aug,ATZWZX3US73L,https://www.coursera.org/account/accomplishments/certificate/ATZWZX3US73L
11,Data Analysis with R Programming,91.42,Course,Google,2022-08-24,22-Aug,QFU2GQPZG59L,https://www.coursera.org/account/accomplishments/certificate/QFU2GQPZG59L
12,Analyze Data to Answer Questions,94.54,Course,Google,2022-08-21,22-Aug,HCFKG7DXBJAP,https://www.coursera.org/account/accomplishments/certificate/HCFKG7DXBJAP
13,Prepare Data for Exploration,92.37,Course,Google,2022-08-16,22-Aug,QL85LR7KHJ24,https://www.coursera.org/account/accomplishments/certificate/QL85LR7KHJ24
14,Process Data from Dirty to Clean,87.67,Course,Google,2022-08-19,22-Aug,BJ55B396HLR8,https://www.coursera.org/account/accomplishments/certificate/BJ55B396HLR8
15,Ask Questions to Make Data-Driven Decisions,93.06,Course,Google,2022-08-13,22-Aug,BYUZ4PQMJ83L,https://www.coursera.org/account/accomplishments/certificate/BYUZ4PQMJ83L
16,"Foundations: Data, Data, Everywhere",98.75,Course,Google,2022-08-10,22-Aug,EKE7Y9JSHZPP,https://www.coursera.org/account/accomplishments/certificate/EKE7Y9JSHZPP
17,Machine Learning with Python,93.16,Course,IBM,2022-05-13,22-May,3HCPJMAKUH39,https://www.coursera.org/account/accomplishments/certificate/3HCPJMAKUH39
18,Introduction to Computer Vision and Image Processing,100,Course,IBM,2022-06-08,22-Jun,VTWF82RQABRR,https://www.coursera.org/account/accomplishments/certificate/VTWF82RQABRR
19,Building Deep Learning Models with TensorFlow,100,Course,IBM,2022-06-12,22-Jun,LMKWQMC4UFNR,https://www.coursera.org/account/accomplishments/certificate/LMKWQMC4UFNR
20,AI Capstone Project with Deep Learning,100,Course,IBM,2022-06-11,22-Jun,FBC5KF7EJZ3C,https://www.coursera.org/account/accomplishments/certificate/FBC5KF7EJZ3C
21,Introduction to Deep Learning & Neural Networks with Keras,100,Course,IBM,2022-06-02,22-Jun,2327AGXDK7Y7,https://www.coursera.org/account/accomplishments/certificate/2327AGXDK7Y7
22,"Python for Data Science, AI & Development",98.8,Course,IBM,2022-06-01,22-Jun,55N9GCM5MPD8,https://www.coursera.org/account/accomplishments/certificate/55N9GCM5MPD8
23,Data Analysis with Python,94.44,Course,IBM,2022-08-31,22-Aug,3S2JNFEA29VM,https://www.coursera.org/account/accomplishments/certificate/3S2JNFEA29VM
24,Data Visualization with Python,93.33,Course,IBM,2022-08-31,22-Aug,ZRFBCJKWQ5U3,https://www.coursera.org/account/accomplishments/certificate/ZRFBCJKWQ5U3
25,Applied Data Science Capstone,86.66,Course,IBM,2022-09-01,22-Sep,A6VTX8MDZFB9,https://www.coursera.org/account/accomplishments/certificate/A6VTX8MDZFB9
26,"ETL and Data Pipelines with Shell, Airflow and Kafka",89,Course,IBM,2022-09-18,22-Sep,44QDZAV7LDNB,https://www.coursera.org/account/accomplishments/certificate/44QDZAV7LDNB
27,Databases and SQL for Data Science with Python,92.75,Course,IBM,2022-09-03,22-Sep,WJTQ2K8Z2QLV,https://www.coursera.org/account/accomplishments/certificate/WJTQ2K8Z2QLV
28,What is Data Science?,89,Course,IBM,2022-09-02,22-Sep,T3KQUH9LGQXP,https://www.coursera.org/account/accomplishments/certificate/T3KQUH9LGQXP
29,Data Science Methodology,90,Course,IBM,2022-09-02,22-Sep,6KRKT4Z49J7Z,https://www.coursera.org/account/accomplishments/certificate/6KRKT4Z49J7Z
30,Tools for Data Science,82.5,Course,IBM,2022-09-02,22-Sep,J7VEL4FLQYRK,https://www.coursera.org/account/accomplishments/certificate/J7VEL4FLQYRK
31,Python Project for Data Science,100,Course,IBM,2022-09-01,22-Sep,Y4NGRG2UM6EH,https://www.coursera.org/account/accomplishments/certificate/Y4NGRG2UM6EH
32,Web Application Technologies and Django,100,Course,University of Michigan,2022-09-25,22-Oct,KF4RFGKXRCNX,https://www.coursera.org/account/accomplishments/certificate/KF4RFGKXRCNX
33,Building Web Applications in Django,100,Course,University of Michigan,2022-09-30,22-Oct,QQFGWZ8JS28G,https://www.coursera.org/account/accomplishments/certificate/QQFGWZ8JS28G
34,"Using JavaScript, JQuery, and JSON in Django",100,Course,University of Michigan,2022-10-15,22-Oct,63R2N5VGS8FN,https://www.coursera.org/account/accomplishments/certificate/63R2N5VGS8FN
35,Django Features and Libraries,100,Course,University of Michigan,2022-10-09,22-Oct,LC32KZYMWLXK,https://www.coursera.org/account/accomplishments/certificate/LC32KZYMWLXK
